{
  "id": "CN-DEMO-001",
  "subject": "chinese",
  "kind": "single_choice",
  "chapter_key": "language",
  "section_key": "pronunciation",
  "tags": ["demo", "字音"],
  "difficulty": "standard",
  "score": 3,
  "stem": [
    {"type": "text", "text": "下列"},
    {"type": "emphasis_dot", "children": [{"type": "text", "text": "加点字"}]},
    {"type": "text", "text": "的读音完全正确的一项是（　）。"}
  ],
  "options": [
    {"label": "A", "content": [{"type": "text", "text": "示例甲（jiǎ）"}]},
    {"label": "B", "content": [{"type": "text", "text": "示例乙（yǐ）"}]},
    {"label": "C", "content": [{"type": "text", "text": "示例丙（bǐng）"}]},
    {"label": "D", "content": [{"type": "text", "text": "示例丁（dīng）"}]}
  ],
  "answer": "A",
  "analysis": [{"type": "text", "text": "此题仅用于验证数据模型和学生版/教师版同源渲染。"}],
  "layout": {
    "choice_mode": "auto",
    "keep_together": true
  }
}
